[
{"id":"AGR_FARM_TRAD","name":"Traditional Farm","role":"extraction","sector":"consumer_staples","module":"agriculture","era":{"start":1700,"end":1850},"hard_inputs":[],"operational_supplies":[{"cargo":"agricultural_supplies","effect":"productivity"}],"outputs":[{"cargo":"grain","amount":1},{"cargo":"livestock","amount":1}],"successor":"AGR_FARM_MECH","lifecycle":"successor"},
{"id":"AGR_FARM_MECH","name":"Mechanized Farm","role":"extraction","sector":"consumer_staples","module":"agriculture","era":{"start":1800,"end":1950},"hard_inputs":[],"operational_supplies":[{"cargo":"agricultural_supplies","effect":"productivity"},{"cargo":"tools_hardware","effect":"efficiency"}],"outputs":[{"cargo":"grain","amount":1},{"cargo":"livestock","amount":1}],"predecessor":"AGR_FARM_TRAD","successor":"AGR_FARM_PREC","lifecycle":"successor"},
{"id":"AGR_FARM_PREC","name":"Precision Farm","role":"extraction","sector":"consumer_staples","module":"agriculture","era":{"start":1980,"end":2045},"hard_inputs":[],"operational_supplies":[{"cargo":"agricultural_supplies","effect":"productivity"},{"cargo":"technology_systems","effect":"efficiency"}],"outputs":[{"cargo":"grain","amount":1},{"cargo":"livestock","amount":1}],"predecessor":"AGR_FARM_MECH","successor":"AGR_FARM_AUTO","lifecycle":"successor"},
{"id":"AGR_FARM_AUTO","name":"Automated Farm","role":"extraction","sector":"consumer_staples","module":"agriculture","era":{"start":2035,"end":2150},"hard_inputs":[],"operational_supplies":[{"cargo":"technology_systems","effect":"efficiency"},{"cargo":"agricultural_supplies","effect":"productivity"}],"outputs":[{"cargo":"grain","amount":1},{"cargo":"livestock","amount":1}],"predecessor":"AGR_FARM_PREC","lifecycle":"successor"},
{"id":"FOR_TRAD","name":"Traditional Forestry","role":"extraction","sector":"materials","module":"forestry","era":{"start":1700,"end":1850},"hard_inputs":[],"operational_supplies":[{"cargo":"tools_hardware","effect":"productivity"}],"outputs":[{"cargo":"timber","amount":1}],"successor":"FOR_IND","lifecycle":"successor"},
{"id":"FOR_IND","name":"Industrial Forestry","role":"extraction","sector":"materials","module":"forestry","era":{"start":1800,"end":1950},"hard_inputs":[],"operational_supplies":[{"cargo":"tools_hardware","effect":"productivity"},{"cargo":"industrial_equipment","effect":"efficiency"}],"outputs":[{"cargo":"timber","amount":1}],"predecessor":"FOR_TRAD","successor":"FOR_MECH","lifecycle":"successor"},
{"id":"FOR_MECH","name":"Mechanized Forestry","role":"extraction","sector":"materials","module":"forestry","era":{"start":1920,"end":2000},"hard_inputs":[],"operational_supplies":[{"cargo":"industrial_equipment","effect":"productivity"},{"cargo":"tools_hardware","effect":"reliability"}],"outputs":[{"cargo":"timber","amount":1}],"predecessor":"FOR_IND","successor":"FOR_PREC","lifecycle":"successor"},
{"id":"FOR_PREC","name":"Precision / Sustainable Forestry","role":"extraction","sector":"materials","module":"forestry","era":{"start":1980,"end":2150},"hard_inputs":[],"operational_supplies":[{"cargo":"industrial_equipment","effect":"productivity"},{"cargo":"technology_systems","effect":"efficiency"}],"outputs":[{"cargo":"timber","amount":1}],"predecessor":"FOR_MECH","lifecycle":"successor"},
{"id":"FIS_COAST","name":"Coastal Fishery","role":"extraction","sector":"consumer_staples","module":"fisheries","era":{"start":1700,"end":1900},"hard_inputs":[],"operational_supplies":[{"cargo":"tools_hardware","effect":"productivity"}],"outputs":[{"cargo":"fish","amount":1}],"successor":"FIS_COMM","lifecycle":"successor"},
{"id":"FIS_COMM","name":"Commercial Fishery","role":"extraction","sector":"consumer_staples","module":"fisheries","era":{"start":1850,"end":1970},"hard_inputs":[],"operational_supplies":[{"cargo":"industrial_equipment","effect":"productivity"},{"cargo":"tools_hardware","effect":"reliability"}],"outputs":[{"cargo":"fish","amount":1}],"predecessor":"FIS_COAST","successor":"FIS_ADV","lifecycle":"successor"},
{"id":"FIS_ADV","name":"Advanced Fishery","role":"extraction","sector":"consumer_staples","module":"fisheries","era":{"start":1970,"end":2150},"hard_inputs":[],"operational_supplies":[{"cargo":"industrial_equipment","effect":"productivity"},{"cargo":"technology_systems","effect":"efficiency"}],"outputs":[{"cargo":"fish","amount":1}],"predecessor":"FIS_COMM","lifecycle":"successor"},
{"id":"MIN_COAL_EARLY","name":"Coal Mine","role":"extraction","sector":"materials","module":"heavy_industry","era":{"start":1700,"end":1900},"hard_inputs":[],"operational_supplies":[{"cargo":"tools_hardware","effect":"productivity"}],"outputs":[{"cargo":"coal","amount":1}],"successor":"MIN_COAL_MECH","lifecycle":"successor"},
{"id":"MIN_COAL_MECH","name":"Mechanized Coal Mine","role":"extraction","sector":"materials","module":"heavy_industry","era":{"start":1850,"end":2000},"hard_inputs":[],"operational_supplies":[{"cargo":"industrial_equipment","effect":"productivity"},{"cargo":"tools_hardware","effect":"reliability"}],"outputs":[{"cargo":"coal","amount":1}],"predecessor":"MIN_COAL_EARLY","successor":"MIN_COAL_MOD","lifecycle":"successor"},
{"id":"MIN_COAL_MOD","name":"Modern Coal Mine","role":"extraction","sector":"materials","module":"heavy_industry","era":{"start":1950,"end":2150},"hard_inputs":[],"operational_supplies":[{"cargo":"industrial_equipment","effect":"productivity"},{"cargo":"technology_systems","effect":"efficiency"}],"outputs":[{"cargo":"coal","amount":1}],"predecessor":"MIN_COAL_MECH","lifecycle":"successor"},
{"id":"MIN_IRON","name":"Iron Mine","role":"extraction","sector":"materials","module":"heavy_industry","era":{"start":1700,"end":1950},"hard_inputs":[],"operational_supplies":[{"cargo":"tools_hardware","effect":"productivity"}],"outputs":[{"cargo":"iron_ore","amount":1}],"successor":"MIN_IRON_MECH","lifecycle":"successor"},
{"id":"MIN_IRON_MECH","name":"Mechanized Iron Mine","role":"extraction","sector":"materials","module":"heavy_industry","era":{"start":1850,"end":2150},"hard_inputs":[],"operational_supplies":[{"cargo":"industrial_equipment","effect":"productivity"},{"cargo":"technology_systems","effect":"efficiency"}],"outputs":[{"cargo":"iron_ore","amount":1}],"predecessor":"MIN_IRON","lifecycle":"successor"},
{"id":"MIN_COPPER","name":"Copper Mine","role":"extraction","sector":"materials","module":"heavy_industry","era":{"start":1850,"end":2150},"hard_inputs":[],"operational_supplies":[{"cargo":"tools_hardware","effect":"productivity"},{"cargo":"industrial_equipment","effect":"efficiency"}],"outputs":[{"cargo":"copper_ore","amount":1}],"successor":"MIN_COPPER_AUTO","lifecycle":"successor"},
{"id":"MIN_COPPER_AUTO","name":"Automated Copper Mine","role":"extraction","sector":"materials","module":"heavy_industry","era":{"start":2030,"end":2150},"hard_inputs":[],"operational_supplies":[{"cargo":"industrial_equipment","effect":"productivity"},{"cargo":"technology_systems","effect":"efficiency"}],"outputs":[{"cargo":"copper_ore","amount":1}],"predecessor":"MIN_COPPER","lifecycle":"successor"},
{"id":"MIN_QUARRY","name":"Quarry","role":"extraction","sector":"materials","module":"construction","era":{"start":1700,"end":2150},"hard_inputs":[],"operational_supplies":[{"cargo":"tools_hardware","effect":"productivity"},{"cargo":"industrial_equipment","effect":"efficiency"}],"outputs":[{"cargo":"stone","amount":1},{"cargo":"sand","amount":1}],"lifecycle":"continuous"},
{"id":"MIN_CLAY","name":"Clay Pit","role":"extraction","sector":"materials","module":"construction","era":{"start":1700,"end":2150},"hard_inputs":[],"operational_supplies":[{"cargo":"tools_hardware","effect":"productivity"},{"cargo":"industrial_equipment","effect":"efficiency"}],"outputs":[{"cargo":"clay","amount":1}],"lifecycle":"continuous"},
{"id":"MIN_BAUXITE","name":"Bauxite Mine","role":"extraction","sector":"materials","module":"heavy_industry","era":{"start":1886,"end":2150},"hard_inputs":[],"operational_supplies":[{"cargo":"tools_hardware","effect":"productivity"},{"cargo":"industrial_equipment","effect":"efficiency"}],"outputs":[{"cargo":"bauxite","amount":1}],"lifecycle":"continuous"},
{"id":"MIN_TITANIUM","name":"Titanium Mine","role":"extraction","sector":"materials","module":"heavy_industry","era":{"start":1940,"end":2150},"hard_inputs":[],"operational_supplies":[{"cargo":"industrial_equipment","effect":"productivity"}],"outputs":[{"cargo":"titanium_ore","amount":1}],"lifecycle":"continuous"},
{"id":"MIN_GOLD","name":"Gold Mine","role":"extraction","sector":"materials","module":"heavy_industry","era":{"start":1700,"end":2150},"hard_inputs":[],"operational_supplies":[{"cargo":"tools_hardware","effect":"productivity"},{"cargo":"industrial_equipment","effect":"efficiency"}],"outputs":[{"cargo":"gold_ore","amount":1}],"lifecycle":"continuous"},
{"id":"MIN_SILVER","name":"Silver Mine","role":"extraction","sector":"materials","module":"heavy_industry","era":{"start":1700,"end":2150},"hard_inputs":[],"operational_supplies":[{"cargo":"tools_hardware","effect":"productivity"},{"cargo":"industrial_equipment","effect":"efficiency"}],"outputs":[{"cargo":"silver_ore","amount":1}],"lifecycle":"continuous"},
{"id":"MIN_RARE_EARTH","name":"Rare Earth Mine","role":"extraction","sector":"materials","module":"heavy_industry","era":{"start":1960,"end":2150},"hard_inputs":[],"operational_supplies":[{"cargo":"industrial_equipment","effect":"productivity"},{"cargo":"technology_systems","effect":"efficiency"}],"outputs":[{"cargo":"rare_earth_ore","amount":1}],"lifecycle":"continuous"},
{"id":"MIN_OIL_ON","name":"Oil Field","role":"extraction","sector":"energy","module":"energy","era":{"start":1850,"end":2150},"hard_inputs":[],"operational_supplies":[{"cargo":"industrial_equipment","effect":"productivity"},{"cargo":"technology_systems","effect":"efficiency"}],"outputs":[{"cargo":"oil","amount":1}],"lifecycle":"continuous"},